{
  "schemaVersion": "phase9.analysis-manifest.v1",
  "objectiveId": "OBJ-2026-04-22-001",
  "experimentId": "EXP-002",
  "analysisId": "ANL-2026-04-23-nb-001",
  "script": {
    "path": "analysis/notebooks/qc.ipynb",
    "sha256": "2222222222222222222222222222222222222222222222222222222222222222",
    "language": "notebook"
  },
  "inputs": [
    {
      "path": "data/input.h5ad",
      "kind": "dataset",
      "sha256": null,
      "sizeBytes": null
    }
  ],
  "outputs": [
    {
      "path": "artifacts/qc-summary.html",
      "kind": "report",
      "sha256": null,
      "sizeBytes": null
    }
  ],
  "command": {
    "runner": "jupyter",
    "argv": [
      "nbconvert",
      "--execute",
      "analysis/notebooks/qc.ipynb"
    ]
  },
  "environment": {
    "interpreterKind": "notebook",
    "interpreterId": "venv_scrna-jupyter",
    "interpreterVersion": "3.13.5",
    "resolver": "operator-managed-venv",
    "executableHint": "../../venv_scrna/Scripts/jupyter.exe",
    "resolutionStatus": "resolved",
    "resolutionReason": "Interpreter identity is pinned; notebook runner stays unsupported until T11.1.2.",
    "dependencyLock": {
      "path": "environment/phase11/requirements-venv-scrna.txt",
      "sha256": null,
      "hashDeferredReason": "Operator-managed venv lock file is not tracked yet."
    },
    "dependencyPins": [
      {
        "name": "jupyter",
        "version": "deferred",
        "scope": "notebook-execution"
      }
    ],
    "environmentFiles": [
      {
        "path": "environment/phase11/hgsoc-cd8-script.js",
        "sha256": null,
        "hashDeferredReason": "Runtime source file hash is recorded by task evidence."
      }
    ],
    "knownSeams": []
  },
  "budget": {
    "maxRuntimeSeconds": 2400,
    "maxMemoryGb": 12,
    "allowNetwork": false
  },
  "safety": {
    "destructive": false,
    "treeWideWrite": false,
    "externalCall": false
  },
  "taskKind": "analysis-execution-run",
  "expectedArtifacts": [
    {
      "path": "artifacts/qc-summary.html",
      "kind": "report",
      "required": true
    }
  ],
  "humanApproval": {
    "approved": false,
    "approvedBy": null,
    "approvedAt": null,
    "reason": null
  },
  "experimentRegistration": {
    "mode": "same-transaction-register",
    "registerInputPath": "analysis/register-experiment.json"
  },
  "createdAt": "2026-04-23T12:05:00Z",
  "createdBy": "sess-wave3-analysis"
}
